<?xml version="1.0" encoding="UTF-8"?>
<model xmlns:xsi="http://www.w3.org/2001/XMLSchema-instance" xsi:noNamespaceSchemaLocation="../../model.xsd">
	<mainMesh>
		<path>assets/Models/Medieval/Female/CubixStudioFemaleNPC.mesh.xml</path>		
		<!--Transformations-->
		<transformation transformationType="rotate" valueX="0.0" valueY="-90" valueZ="0.0"></transformation>
                <transformation transformationType="scale" valueX="2.25" valueY="2.25" valueZ="2.25"></transformation>
                <transformation transformationType="translate" valueX="-0.25" valueY="-2.5" valueZ="0.0"></transformation>
                <!--Textures-->
		<mainMeshTextures>
			<!-- skinPanel textures-->
			<simpleTexture idPanelRef="skinsPanel" layer="0" default="true" idTexture="idPielCasual">
				<iconPath>assets/Interface/Icons/eAdventure/Boy/IconoPielBlancaBoy.png</iconPath>
				<path>assets/Textures/Medieval/Female/SkinFemaleCasual.png</path>
			</simpleTexture>
			<simpleTexture idPanelRef="skinsPanel" layer="0" default="false" idTexture="idPielMedieval">
				<iconPath>assets/Interface/Icons/eAdventure/Boy/IconoPielNegraBoy.png</iconPath>
				<path>assets/Textures/Medieval/Female/SkinFemaleMedieval.png</path>
			</simpleTexture>
			<!-- hairs textures -->
			<simpleTexture idPanelRef="hairsPanel" layer="0" idTexture="idPeloCasual" default="true">
				<iconPath>assets/Interface/Icons/eAdventure/Boy/IconoPielNegraBoy.png</iconPath>
				<path>assets/Textures/Medieval/Female/HairFemaleCasual.png</path>
			</simpleTexture>
			<simpleTexture idPanelRef="hairsPanel" layer="0" idTexture="idPeloMedieval" default="false">
				<iconPath>assets/Interface/Icons/eAdventure/Boy/IconoPielBlancaBoy.png</iconPath>
				<path>assets/Textures/Medieval/Female/HairFemaleMedieval.png</path>
			</simpleTexture>
			<!-- eyes textures-->
			<simpleTexture idPanelRef="eyesPanel" layer="1" idTexture="idOjosCasual" default="true">
				<iconPath>assets/Interface/Icons/eAdventure/Boy/IconoOjosBoy.png</iconPath>
				<path>assets/Textures/Medieval/Female/EyeColorFemaleCasual.png</path>
			</simpleTexture>
			<simpleTexture idPanelRef="eyesPanel" layer="1" idTexture="idOjosMedieval" default="false">
				<iconPath>assets/Interface/Icons/eAdventure/Boy/IconoOjosBoy.png</iconPath>
				<path>assets/Textures/Medieval/Female/EyeColorFemaleMedieval.png</path>
			</simpleTexture>
			<!-- clothesPanel textures-->	
			<simpleTexture idPanelRef="shirtsPanel" layer="0" idTexture="idCamisetaCasual" default="true"	>
				<iconPath>assets/Interface/Icons/eAdventure/Boy/IconoCamisaCortaBoy.png</iconPath>
				<path>assets/Textures/Medieval/Female/CoatFemaleCasual.png</path>
			</simpleTexture>
			<simpleTexture idPanelRef="trousersPanel" layer="0" idTexture="idFaldaCasual" default="true"	>
				<iconPath>assets/Interface/Icons/eAdventure/Boy/IconoPantalonCortoBoy.png</iconPath>
				<path>assets/Textures/Medieval/Female/SkirtFemaleCasual.png</path>
			</simpleTexture>
			<simpleTexture idPanelRef="shirtsPanel" layer="0" idTexture="idVestidoMedieval" default="false"	>
				<iconPath>assets/Interface/Icons/eAdventure/Boy/IconoCamisaLargaBoy.png</iconPath>
				<path>assets/Textures/Medieval/Female/ClothFemaleMedieval.png</path>
			</simpleTexture>
			<!-- shoesPanel textures-->
			<simpleTexture idPanelRef="shoesPanel" layer="0" idTexture="idZapatosCasual" default="true">
				<iconPath>assets/Interface/Icons/eAdventure/Boy/IconoZapatosBoy.png</iconPath>
				<path>assets/Textures/Medieval/Female/ShoesFemaleCasual.png</path>
			</simpleTexture>
			<simpleTexture idPanelRef="shoesPanel" layer="1" idTexture="idZapatosMedieval" default="false">
				<iconPath>assets/Interface/Icons/eAdventure/Boy/IconoZapatosBoy.png</iconPath>
				<path>assets/Textures/Medieval/Female/BootsFemaleMedieval.png</path>
			</simpleTexture>
			<!-- accesoriesPanel textures-->
			<simpleTexture idPanelRef="accesoriesPanel" layer="1" idTexture="idSujetador" default="true">
				<iconPath>assets/Textures/Medieval/Female/UnderwearFemaleCasual.png</iconPath>
				<path>assets/Textures/Medieval/Female/UnderwearFemaleCasual.png</path>
			</simpleTexture>
			<simpleTexture idPanelRef="accesoriesPanel" layer="1" idTexture="idCinta" default="false">
				<iconPath>assets/Textures/Medieval/Female/HeadbandFemaleMedieval.png</iconPath>
				<path>assets/Textures/Medieval/Female/HeadbandFemaleMedieval.png</path>
			</simpleTexture>
			<simpleTexture idPanelRef="accesoriesPanel" layer="1" idTexture="idLabiosCasual" default="true">
				<iconPath>assets/Textures/Medieval/Female/LipsFemaleCasual.png</iconPath>
				<path>assets/Textures/Medieval/Female/LipsFemaleCasual.png</path>
			</simpleTexture>
			<simpleTexture idPanelRef="accesoriesPanel" layer="1" idTexture="idLabiosMedieval" default="false">
				<iconPath>assets/Textures/Medieval/Female/LipsFemaleMedieval.png</iconPath>
				<path>assets/Textures/Medieval/Female/LipsFemaleMedieval.png</path>
			</simpleTexture>
		</mainMeshTextures>
		<!--Bones-->
		<bones>
			<!-- Dar valores a los huesos, Los que hay son aleatorios -->
			<bone idControllerRef="head" defaultValue="0" minValue="-50" maxValue="100" boneName="Bip01 Head"/>
			<bone idControllerRef="arms" defaultValue="0" minValue="-50" maxValue="100" boneName="Bip01 L Clavicle"/>
			<bone idControllerRef="arms" defaultValue="0" minValue="-50" maxValue="100" boneName="Bip01 R Clavicle"/>
			<bone idControllerRef="hands" defaultValue="0" minValue="-50" maxValue="100" boneName="Bip01 L Hand"/>
			<bone idControllerRef="hands" defaultValue="0" minValue="-50" maxValue="100" boneName="Bip01 R Hand"/>
			<bone idControllerRef="legs" defaultValue="0" minValue="-50" maxValue="100" boneName="Bip01 L Calf"/>
			<bone idControllerRef="legs" defaultValue="0" minValue="-50" maxValue="100" boneName="Bip01 R Calf"/>
			<bone idControllerRef="feet" defaultValue="0" minValue="-50" maxValue="100" boneName="Bip01 L Foot"/>
			<bone idControllerRef="feet" defaultValue="0" minValue="-50" maxValue="100" boneName="Bip01 R Foot"/>
		</bones>		
		<!--Physical Builds-->
		<physicalBuilds>
			<physicalBuild label="idPhysicalBuildLabel1" idPanelRef="ScalePanel" idPhysicalBuild="idMediumBuilt">
				<escalation boneName="ALL" valueX="1.0" valueY="1.0" valueZ="1.0"/>
                                <escalation boneName="Cabeza" valueX="1.0" valueY="1.0" valueZ="1.0"/>
			</physicalBuild>
			<physicalBuild label="idPhysicalBuildLabel2" idPanelRef="ScalePanel" idPhysicalBuild="idHeavy">
				<escalation boneName="ALL" valueX="1.50" valueY="1.0" valueZ="1.0"/>
				<escalation boneName="Cabeza" valueX="0.66" valueY="1.0" valueZ="1.0"/>
			</physicalBuild>
			<physicalBuild label="idPhysicalBuildLabel3" idPanelRef="ScalePanel" idPhysicalBuild="idThin">
				<escalation boneName="ALL" valueX="0.65" valueY="1.0" valueZ="1.0"/>
				<escalation boneName="Cabeza" valueX="1.54" valueY="1.0" valueZ="1.0"/>
			</physicalBuild>
			<physicalBuild label="idPhysicalBuildLabel4" idPanelRef="ScalePanel" idPhysicalBuild="idTall">
				<escalation boneName="ALL" valueX="1.1" valueY="1.25" valueZ="1.25"/>
				<escalation boneName="Cabeza" valueX="0.91" valueY="0.8" valueZ="0.8"/>
			</physicalBuild>
			<physicalBuild label="idPhysicalBuildLabel5" idPanelRef="ScalePanel" idPhysicalBuild="idSmall">
				<escalation boneName="ALL" valueX="0.9" valueY="0.75" valueZ="0.75"/>
				<escalation boneName="Cabeza" valueX="1.11" valueY="1.33" valueZ="1.33"/>
			</physicalBuild>
		</physicalBuilds>
	</mainMesh>	
	<languagesPath>assets/Locale/Medieval/Female</languagesPath>
</model>
