<?xml version="1.0" encoding="UTF-8"?>
<model xmlns:xsi="http://www.w3.org/2001/XMLSchema-instance" xsi:noNamespaceSchemaLocation="../../model.xsd">
	<mainMesh>
		<path>assets/Families/Cubix Studio/Models/Female/CubixStudioFemaleNPC.mesh.xml</path>		
		<!--Transformations-->
		<transformation transformationType="rotate" valueX="0.0" valueY="-77.0" valueZ="0.0"></transformation>
                <transformation transformationType="scale" valueX="2.25" valueY="2.25" valueZ="2.25"></transformation>
                <transformation transformationType="translate" valueX="-2.65" valueY="-2.9" valueZ="0.0"></transformation>
                <!--Textures-->
		<mainMeshTextures>
			<!-- skinPanel textures-->
			<simpleTexture idPanelRef="skinsPanel" layer="0" default="true" idTexture="idPielCasual" text="idTextPielCasual">
				<iconPath>assets/Families/eAdventure/Icons/Boy/IconoPielBlancaBoy.png</iconPath>
				<path>assets/Families/Cubix Studio/Textures/Female/SkinFemaleCasual.png</path>
			</simpleTexture>
			<simpleTexture idPanelRef="skinsPanel" layer="0" default="false" idTexture="idPielMedieval" text="idTextPielMedieval">
				<iconPath>assets/Families/eAdventure/Icons/Boy/IconoPielNegraBoy.png</iconPath>
				<path>assets/Families/Cubix Studio/Textures/Female/SkinFemaleMedieval.png</path>
			</simpleTexture>
			<!-- hairs textures -->
			<simpleTexture idPanelRef="hairsPanel" layer="0" idTexture="idPeloCasual" default="true"  text="idTextPeloCasual">
				<iconPath>assets/Families/eAdventure/Icons/Boy/IconoPielNegraBoy.png</iconPath>
				<path>assets/Families/Cubix Studio/Textures/Female/HairFemaleCasual.png</path>
			</simpleTexture>
			<simpleTexture idPanelRef="hairsPanel" layer="0" idTexture="idPeloMedieval" default="false"  text="idTextPeloMedieval">
				<iconPath>assets/Families/eAdventure/Icons/Boy/IconoPielBlancaBoy.png</iconPath>
				<path>assets/Families/Cubix Studio/Textures/Female/HairFemaleMedieval.png</path>
			</simpleTexture>
			<!-- eyes textures-->
			<simpleTexture idPanelRef="eyesPanel" layer="1" idTexture="idOjosCasual" default="true"  text="idTextOjosCasual">
				<iconPath>assets/Families/eAdventure/Icons/Boy/IconoOjosBoy.png</iconPath>
				<path>assets/Families/Cubix Studio/Textures/Female/EyeColorFemaleCasual.png</path>
			</simpleTexture>
			<simpleTexture idPanelRef="eyesPanel" layer="1" idTexture="idOjosMedieval" default="false"  text="idTextOjosMedieval">
				<iconPath>assets/Families/eAdventure/Icons/Boy/IconoOjosBoy.png</iconPath>
				<path>assets/Families/Cubix Studio/Textures/Female/EyeColorFemaleMedieval.png</path>
			</simpleTexture>
			<!-- clothesPanel textures-->	
			<simpleTexture idPanelRef="shirtsPanel" layer="0" idTexture="idCamisetaCasual" default="true"	  text="idTextCamisetaCasual">
				<iconPath>assets/Families/eAdventure/Icons/Boy/IconoCamisaCortaBoy.png</iconPath>
				<path>assets/Families/Cubix Studio/Textures/Female/CoatFemaleCasual.png</path>
			</simpleTexture>
			<simpleTexture idPanelRef="trousersPanel" layer="0" idTexture="idFaldaCasual" default="true" text="idTextFaldaCasual">
				<iconPath>assets/Families/eAdventure/Icons/Boy/IconoPantalonCortoBoy.png</iconPath>
				<path>assets/Families/Cubix Studio/Textures/Female/SkirtFemaleCasual.png</path>
			</simpleTexture>
			<simpleTexture idPanelRef="shirtsPanel" layer="0" idTexture="idVestidoMedieval" default="false"  text="idTextVestidoMedieval">
				<iconPath>assets/Families/eAdventure/Icons/Boy/IconoCamisaLargaBoy.png</iconPath>
				<path>assets/Families/Cubix Studio/Textures/Female/ClothFemaleMedieval.png</path>
			</simpleTexture>
			<!-- shoesPanel textures-->
			<simpleTexture idPanelRef="shoesPanel" layer="0" idTexture="idZapatosCasual" default="true"  text="idTextZapatosCasual">
				<iconPath>assets/Families/eAdventure/Icons/Boy/IconoZapatosBoy.png</iconPath>
				<path>assets/Families/Cubix Studio/Textures/Female/ShoesFemaleCasual.png</path>
			</simpleTexture>
			<simpleTexture idPanelRef="shoesPanel" layer="1" idTexture="idZapatosMedieval" default="false"  text="idTextZapatosMedieval">
				<iconPath>assets/Families/eAdventure/Icons/Boy/IconoZapatosBoy.png</iconPath>
				<path>assets/Families/Cubix Studio/Textures/Female/BootsFemaleMedieval.png</path>
			</simpleTexture>
			<!-- accesoriesPanel textures-->
			<simpleTexture idPanelRef="accesoriesPanel" layer="1" idTexture="idRopaInterior" default="true"  text="idTextRopaInterior">
				<iconPath>assets/Families/Cubix Studio/Textures/Female/UnderwearFemaleCasual.png</iconPath>
				<path>assets/Families/Cubix Studio/Textures/Female/UnderwearFemaleCasual.png</path>
			</simpleTexture>
			<simpleTexture idPanelRef="accesoriesPanel" layer="1" idTexture="idCinta" default="false"  text="idTextCinta">
				<iconPath>assets/Families/Cubix Studio/Textures/Female/HeadbandFemaleMedieval.png</iconPath>
				<path>assets/Families/Cubix Studio/Textures/Female/HeadbandFemaleMedieval.png</path>
			</simpleTexture>
			<simpleTexture idPanelRef="accesoriesPanel" layer="1" idTexture="idLabiosCasual" default="true"  text="idTextLabiosCasual">
				<iconPath>assets/Families/Cubix Studio/Textures/Female/LipsFemaleCasual.png</iconPath>
				<path>assets/Families/Cubix Studio/Textures/Female/LipsFemaleCasual.png</path>
			</simpleTexture>
			<simpleTexture idPanelRef="accesoriesPanel" layer="1" idTexture="idLabiosMedieval" default="false"  text="idTextLabiosMedieval">
				<iconPath>assets/Families/Cubix Studio/Textures/Female/LipsFemaleMedieval.png</iconPath>
				<path>assets/Families/Cubix Studio/Textures/Female/LipsFemaleMedieval.png</path>
			</simpleTexture>
		</mainMeshTextures>
		<!--Bones-->
		<bones>
			<!-- Dar valores a los huesos, Los que hay son aleatorios -->
			<bone idControllerRef="head" defaultValue="0" minValue="-50" maxValue="100" boneName="Bip01 Head"/>
			<bone idControllerRef="arms" defaultValue="0" minValue="-50" maxValue="100" boneName="Bip01 L Clavicle"/>
			<bone idControllerRef="arms" defaultValue="0" minValue="-50" maxValue="100" boneName="Bip01 R Clavicle"/>
			<bone idControllerRef="hands" defaultValue="0" minValue="-50" maxValue="100" boneName="Bip01 L Hand"/>
			<bone idControllerRef="hands" defaultValue="0" minValue="-50" maxValue="100" boneName="Bip01 R Hand"/>
			<bone idControllerRef="legs" defaultValue="0" minValue="-50" maxValue="100" boneName="Bip01 L Calf"/>
			<bone idControllerRef="legs" defaultValue="0" minValue="-50" maxValue="100" boneName="Bip01 R Calf"/>
			<bone idControllerRef="feet" defaultValue="0" minValue="-50" maxValue="100" boneName="Bip01 L Foot"/>
			<bone idControllerRef="feet" defaultValue="0" minValue="-50" maxValue="100" boneName="Bip01 R Foot"/>
		</bones>		
		<!--Physical Builds-->
		<physicalBuilds>
			<physicalBuild label="idPhysicalBuildLabel1" idPanelRef="ScalePanel" idPhysicalBuild="idMediumBuilt">
				<escalation boneName="ALL" valueX="0.444" valueY="0.444" valueZ="0.444"/>
                                <escalation boneName="Bip01_Head" valueX="0.66" valueY="1.0" valueZ="1.0"/>
			</physicalBuild>
                        <physicalBuild label="idPhysicalBuildLabel2" idPanelRef="ScalePanel" idPhysicalBuild="idTall">
				<escalation boneName="ALL" valueX="0.488" valueY="0.555" valueZ="0.555"/>
                                <escalation boneName="Bip01_Head" valueX="0.66" valueY="1.0" valueZ="1.0"/>
			</physicalBuild>
                        <physicalBuild label="idPhysicalBuildLabel3" idPanelRef="ScalePanel" idPhysicalBuild="idSmall">
				<escalation boneName="ALL" valueX="0.4" valueY="0.333" valueZ="0.333"/>
                                <escalation boneName="Bip01_Head" valueX="0.66" valueY="1.0" valueZ="1.0"/>
			</physicalBuild>
		</physicalBuilds>
	</mainMesh>	
	<languagesPath>assets/Families/Cubix Studio/Locale/Female</languagesPath>
</model>
